{
  "lead": "作業を1回終えるたびにその日の回数を保存し、タイマーの下に大きく表示するようにしました。",
  "nodes": [
    {
      "id": "n-baba4cd4e01c",
      "title": "作業の時間切れ",
      "caption": "残り時間が0になると作業を終える処理を呼びます。",
      "hunkIds": []
    },
    {
      "id": "n-d1073b3e5753",
      "title": "ページを開いたとき",
      "caption": "保存された今日の回数を画面に読み込みます。",
      "hunkIds": []
    },
    {
      "id": "n-2bb15fadadbb",
      "title": "タブに戻ったとき",
      "caption": "画面に戻ると回数を読み直します。",
      "hunkIds": [
        "h-2420dc43fe0a"
      ]
    },
    {
      "id": "n-84790cb598e3",
      "title": "別のタブが保存したとき",
      "caption": "別のタブで変わった回数を読み直します。",
      "hunkIds": [
        "h-7fe8eb6b72ec"
      ]
    },
    {
      "id": "n-f4886f7ffcd1",
      "title": "1秒ごと",
      "caption": "日付が変わった場合も表示を更新します。",
      "hunkIds": []
    },
    {
      "id": "n-7910aecf8e91",
      "title": "作業を終える処理",
      "caption": "作業の終了時にその日の回数を記録します。",
      "hunkIds": [
        "h-c7a2fc15a207"
      ]
    },
    {
      "id": "n-9cf21932a262",
      "title": "回数を1足して保存",
      "caption": "終了した時刻の日付に1を足して保存します。",
      "hunkIds": [
        "h-9319192d5977"
      ]
    },
    {
      "id": "n-c887f887f746",
      "title": "画面の数字を読み直す",
      "caption": "今日の日付に対応する数を画面に表示します。",
      "hunkIds": []
    },
    {
      "id": "n-67df517d96f7",
      "title": "日付ごとの回数を読む",
      "caption": "画面内の数と保存された数の大きいほうを使います。",
      "hunkIds": []
    },
    {
      "id": "n-3d2e4b19b0d8",
      "title": "ブラウザの保存",
      "caption": "日付ごとの回数をブラウザに保存します。",
      "hunkIds": [
        "h-954125474537"
      ]
    },
    {
      "id": "n-3d8b146d09a6",
      "title": "画面の欄",
      "caption": "今日の作業回数を大きな数字で表示します。",
      "hunkIds": [
        "h-839cec3a40f2",
        "h-159d9c242bdc"
      ]
    },
    {
      "id": "n-399aa1ab477d",
      "title": "250ミリ秒ごと",
      "caption": "定期的に残り時間を確かめます。",
      "hunkIds": []
    },
    {
      "id": "n-1e328aadba88",
      "title": "日付",
      "caption": "端末の現地日付を求めます。",
      "hunkIds": []
    }
  ],
  "edges": [
    "e-5f55dd483c50",
    "e-ed2d8c9a3a95",
    "e-c6910d9e772e",
    "e-9873862b88a2",
    "e-6b5873e28646",
    "e-8e7ac6ab2229",
    "e-1b44bedd2170",
    "e-65335a57b99f",
    "e-7d520c4c9cf8",
    "e-f834fdb7c9c1",
    "e-4007abdb46ea",
    "e-30ee01417b00",
    "e-a200525f409c",
    "e-3e8af56942d5",
    "e-a2287245808b",
    "e-a40ee51e7157"
  ],
  "offMap": [
    {
      "title": "CSS",
      "caption": "回数の欄の余白と文字の大きさを指定します。",
      "hunkIds": [
        "h-ac092537fa7d"
      ]
    },
    {
      "title": "README",
      "caption": "回数の表示と保存の扱いを記録します。",
      "hunkIds": [
        "h-64a09a5f389e"
      ]
    },
    {
      "title": "テストのファイル",
      "caption": "作業の完了、日付、保存、別のタブの動きを検査します。",
      "hunkIds": [
        "h-06341ba05255"
      ]
    }
  ],
  "interpretations": [
    {
      "decision": "休憩・中断・リセットでは回数を増やさない",
      "evidence": "自動テスト1・2"
    },
    {
      "decision": "回数をブラウザに保存し、再読み込み後も残す",
      "evidence": "自動テスト3、画面の連続画像"
    },
    {
      "decision": "端末の現地日付で集計し、作業が終わった時刻の日付を使う",
      "evidence": "自動テスト3・4・5"
    },
    {
      "decision": "保存を利用できない場合もページ内で数え続ける",
      "evidence": "自動テスト7"
    },
    {
      "decision": "別のタブで保存した回数を表示にも反映する",
      "evidence": "自動テスト8"
    }
  ],
  "concerns": [
    {
      "text": "二つのタブで同時に終えると、同じ数を読んで1回分が失われる可能性があります。",
      "file": "index.html",
      "line": 476
    },
    {
      "text": "別のタブとの同期のため、1秒ごとに保存を読み直します。",
      "file": "index.html",
      "line": 727
    }
  ],
  "unverified": [
    "日付が変わる瞬間の表示は実際の画面では未確認です。",
    "二つのタブで同時に作業を終える動きは未確認です。"
  ]
}
