{
  "lead": "タイマー画面に今日の作業回数を大きく表示し、作業完了時の加算と再読み込み後の保持を実装して、自動テスト8件が成功しました。",
  "nodes": [
    {
      "id": "n-399aa1ab477d",
      "title": "短い間隔ごと",
      "caption": "タイマーの終了時刻を定期的に確かめます。",
      "hunkIds": []
    },
    {
      "id": "n-cc56f49982b8",
      "title": "終了時刻を確かめる",
      "caption": "時間が尽きたら完了処理へ進みます。",
      "hunkIds": []
    },
    {
      "id": "n-614c2e6a8758",
      "title": "作業の完了を処理する",
      "caption": "作業タイマーが完了したときに回数の加算を呼びます。",
      "hunkIds": [
        "h-c7a2fc15a207"
      ]
    },
    {
      "id": "n-1de773c51c31",
      "title": "回数を1足して保存",
      "caption": "完了時刻の日付の回数を増やし、保存して表示を更新します。",
      "hunkIds": [
        "h-9319192d5977"
      ]
    },
    {
      "id": "n-d4c2a482f7e0",
      "title": "日付",
      "caption": "端末の現地日付を求めます。",
      "hunkIds": []
    },
    {
      "id": "n-0de2e0efb3e3",
      "title": "回数を読み出す",
      "caption": "保存された有効な回数とページ内の回数を照らし合わせます。",
      "hunkIds": [
        "h-954125474537"
      ]
    },
    {
      "id": "n-3d2e4b19b0d8",
      "title": "ブラウザの保存",
      "caption": "日付ごとの作業回数を保持します。",
      "hunkIds": []
    },
    {
      "id": "n-23bff47b564d",
      "title": "画面の数字を読み直す",
      "caption": "今日の回数を読み、表示を更新します。",
      "hunkIds": [
        "h-159d9c242bdc",
        "h-7fe8eb6b72ec"
      ]
    },
    {
      "id": "n-3d8b146d09a6",
      "title": "画面の欄",
      "caption": "今日の作業回数を表示します。",
      "hunkIds": [
        "h-839cec3a40f2"
      ]
    },
    {
      "id": "n-d1073b3e5753",
      "title": "ページを開いたとき",
      "caption": "保存済みの今日の回数を画面へ反映します。",
      "hunkIds": []
    },
    {
      "id": "n-2bb15fadadbb",
      "title": "タブに戻ったとき",
      "caption": "タイマーの終了と今日の回数を確かめ直します。",
      "hunkIds": [
        "h-2420dc43fe0a"
      ]
    },
    {
      "id": "n-84790cb598e3",
      "title": "別のタブで保存されたとき",
      "caption": "別のタブで変わった回数を画面へ反映します。",
      "hunkIds": []
    },
    {
      "id": "n-f4886f7ffcd1",
      "title": "1秒ごと",
      "caption": "日付の切り替わりを含めて表示を確かめ直します。",
      "hunkIds": []
    }
  ],
  "edges": [
    "e-e0e5e29fdc00",
    "e-43bf534817fc",
    "e-40550d5c3c86",
    "e-e59de1641bfd",
    "e-d782f91c7dd0",
    "e-2147e0fb00d9",
    "e-244313478b55",
    "e-ef3358252aff",
    "e-b495b6e338f9",
    "e-bfda87b14691",
    "e-c24d6c5231fe",
    "e-fd1061f3c1cd",
    "e-32ddfb55683e",
    "e-c9ae69bf68d7",
    "e-5b77e2776396",
    "e-403ff3f0e370"
  ],
  "offMap": [
    {
      "title": "表示の見た目",
      "caption": "今日の回数を大きく見せるための余白、色、文字サイズを設定します。",
      "hunkIds": [
        "h-ac092537fa7d"
      ]
    },
    {
      "title": "説明文",
      "caption": "加算する条件、保存方法、日付の扱いを説明します。",
      "hunkIds": [
        "h-64a09a5f389e"
      ]
    },
    {
      "title": "自動テスト",
      "caption": "作業回数に関する8件の自動テストを追加します。",
      "hunkIds": [
        "h-06341ba05255"
      ]
    }
  ],
  "interpretations": [
    {
      "decision": "休憩の完了や中断、リセットでは回数を増やさない。",
      "evidence": "加算の呼び出しは作業タイマーが完了した場合の分岐内にあります。"
    },
    {
      "decision": "回数を記録する日付は、確認した時刻ではなくタイマーの終了時刻で決める。",
      "evidence": "加算処理は終了予定時刻から端末の現地日付を求めています。"
    },
    {
      "decision": "保存された値が不正な場合は採用せず、保存できない場合も開いているページ内では回数を保持する。",
      "evidence": "読み出し時に安全な非負整数かを確認し、保存の失敗を処理したうえでページ内の値を更新しています。"
    },
    {
      "decision": "日付が変わったら表示対象を当日分へ切り替える。",
      "evidence": "画面の再表示時に現在の現地日付を求め、1秒ごとの再表示も登録しています。"
    },
    {
      "decision": "別のタブで保存が変わった場合も表示を読み直す。",
      "evidence": "ブラウザの保存変更イベントに表示更新を登録しています。"
    }
  ],
  "concerns": [
    {
      "text": "複数のタブで同時に作業を完了すると、両方が同じ回数を読み、片方の加算が保存時に失われる可能性があります。",
      "file": "index.html",
      "line": 476
    }
  ],
  "unverified": [
    "画面画像の実物は提示されていないため、表示の大きさや配置は確認できていません。",
    "実際のブラウザでの操作は承認ポリシーにより実施されていません。"
  ]
}
