{
  "lead": "タイマー画面に今日の作業回数を大きく表示し、作業完了時の加算と再読み込み後の保持を追加しました。",
  "nodes": [
    {
      "id": "n-399aa1ab477d",
      "title": "タイマーの定期実行",
      "caption": "定期実行から残り時間の判定へ進みます。",
      "hunkIds": []
    },
    {
      "id": "n-baba4cd4e01c",
      "title": "残り時間の判定",
      "caption": "作業時間が終わると完了処理を呼び出します。",
      "hunkIds": []
    },
    {
      "id": "n-7910aecf8e91",
      "title": "タイマーの完了処理",
      "caption": "作業タイマーの完了時に当日の回数を記録します。",
      "hunkIds": [
        "h-c7a2fc15a207"
      ]
    },
    {
      "id": "n-9cf21932a262",
      "title": "作業完了の記録",
      "caption": "完了時刻の日付を使って回数を加算し、保存と表示更新を行います。",
      "hunkIds": [
        "h-9319192d5977"
      ]
    },
    {
      "id": "n-1e328aadba88",
      "title": "現地日付の取得",
      "caption": "端末の現地日付を日別集計に使います。",
      "hunkIds": []
    },
    {
      "id": "n-67df517d96f7",
      "title": "当日の回数の取得",
      "caption": "保存済みの値を読み、利用できない場合はページ内の値を使います。",
      "hunkIds": []
    },
    {
      "id": "n-3d2e4b19b0d8",
      "title": "ブラウザ内の保存先",
      "caption": "日付ごとの作業回数をブラウザに保存します。",
      "hunkIds": [
        "h-954125474537"
      ]
    },
    {
      "id": "n-c887f887f746",
      "title": "回数の表示更新",
      "caption": "当日の回数を取得して画面の数字を更新します。",
      "hunkIds": [
        "h-159d9c242bdc"
      ]
    },
    {
      "id": "n-3d8b146d09a6",
      "title": "今日の作業回数",
      "caption": "タイマー画面に回数と説明を表示します。",
      "hunkIds": [
        "h-839cec3a40f2"
      ]
    },
    {
      "id": "n-d1073b3e5753",
      "title": "ページの読み込み",
      "caption": "ページを開いたときに当日の回数を表示します。",
      "hunkIds": []
    },
    {
      "id": "n-2bb15fadadbb",
      "title": "画面への復帰",
      "caption": "画面に戻ったときに回数を表示し直します。",
      "hunkIds": [
        "h-2420dc43fe0a"
      ]
    },
    {
      "id": "n-84790cb598e3",
      "title": "別タブでの保存",
      "caption": "別タブで保存内容が変わると回数を表示し直します。",
      "hunkIds": []
    },
    {
      "id": "n-f4886f7ffcd1",
      "title": "日付の定期確認",
      "caption": "一秒ごとに表示を更新して日付の切り替わりを反映します。",
      "hunkIds": [
        "h-7fe8eb6b72ec"
      ]
    }
  ],
  "edges": [
    "e-a200525f409c",
    "e-5f55dd483c50",
    "e-ed2d8c9a3a95",
    "e-a40ee51e7157",
    "e-9873862b88a2",
    "e-6b5873e28646",
    "e-c6910d9e772e",
    "e-1b44bedd2170",
    "e-8e7ac6ab2229",
    "e-a2287245808b",
    "e-65335a57b99f",
    "e-7d520c4c9cf8",
    "e-f834fdb7c9c1",
    "e-4007abdb46ea",
    "e-30ee01417b00"
  ],
  "offMap": [
    {
      "title": "表示のスタイル",
      "caption": "回数を大きく見せるための配置、文字サイズ、色を追加しました。",
      "hunkIds": [
        "h-ac092537fa7d"
      ]
    },
    {
      "title": "利用説明",
      "caption": "加算の条件、保存、日付の扱いを説明に追記しました。",
      "hunkIds": [
        "h-64a09a5f389e"
      ]
    },
    {
      "title": "自動テスト",
      "caption": "作業回数の動作を確認するテストを追加し、8件すべてが成功しました。",
      "hunkIds": [
        "h-06341ba05255"
      ]
    }
  ],
  "interpretations": [
    {
      "decision": "作業回数は作業タイマーの完了時だけ加算し、休憩や中断、リセットでは加算しない。",
      "evidence": "完了処理の作業モード分岐内で記録関数を呼んでおり、自動テストは8件成功しています。"
    },
    {
      "decision": "日付は端末の現地日付で区切り、画面の更新が遅れた場合もタイマーの終了予定時刻の日付に計上する。",
      "evidence": "日付取得関数は現地時刻を使い、記録関数は終了予定時刻を渡しています。"
    },
    {
      "decision": "回数を日付別にブラウザへ保存し、保存できない場合はページを開いている間だけ保持する。",
      "evidence": "日付別の保存キーとページ内の記録領域があり、保存の読み書きは失敗を処理しています。"
    },
    {
      "decision": "再読み込み時、別タブでの保存時、画面への復帰時、日付の切り替わり時に表示を更新する。",
      "evidence": "初期表示、保存内容の変更通知、画面復帰通知、一秒ごとの更新処理が追加されています。"
    }
  ],
  "concerns": [
    {
      "text": "複数のタブで同時に作業が完了すると、同じ保存値をそれぞれ加算して書き戻し、一回分が失われる可能性があります。",
      "file": "index.html",
      "line": 479
    }
  ],
  "unverified": [
    "提示された撮影済み画像の実物は参照データに含まれず、表示の見た目は確認できていません。",
    "実ブラウザでの操作確認は承認ポリシーにより実施できていません。"
  ]
}